{
  "category": "Agentic SDLC Process Orchestrators",
  "category_pack_id": "agentic-sdlc-process-orchestrator",
  "audience": "startup engineering leaders",
  "persona_id": "startup",
  "license_preference": "mixed",
  "must_haves": [
    "workflow composition",
    "multi-agent orchestration",
    "verification gates",
    "cross-session state",
    "process layer above host runtime"
  ],
  "must_research": [
    "silver-bullet",
    "ai-dlc",
    "agentsys",
    "sdlc-plugin",
    "deepwork",
    "workflow-manager",
    "turboshovel",
    "cavekit-v31",
    "barkain-workflow-orchestrator",
    "conductor",
    "cc10x",
    "director",
    "claude-harness",
    "claude-code-expert",
    "agenthub",
    "ateam",
    "zuvo",
    "gsd",
    "superpowers",
    "bmad",
    "spec-kit",
    "superclaude",
    "ruflo",
    "oh-my-pi",
    "factory-ai",
    "devin",
    "augment-cosmos",
    "tembo",
    "cursor",
    "claude-code",
    "codex",
    "github-copilot",
    "magic-dev"
  ],
  "allow_adjacent_section": true,
  "adjacent_categories": [
    "SDLC plugin substitutes (BMAD, GSD, Superpowers, Spec Kit, Oh My, Zuvo OSS)",
    "agentic SDLC SaaS (Factory, Devin, Augment Cosmos)",
    "host runtimes (Cursor, Claude Code, Codex)",
    "generic agent frameworks (LangGraph, CrewAI)"
  ],
  "hard_vetoes": [
    "cursor-background-agents",
    "sweep",
    "windsurf",
    "amazon-q-developer",
    "sourcegraph-cody",
    "poolside",
    "coderabbit",
    "jetbrains-ai-assistant"
  ],
  "success_criteria": [
    "Three market charts (APO, SDLC plugins, agentic SDLC SaaS) with per-market solution cards",
    "BMAD, GSD, Superpowers, Spec Kit, Zuvo cards present; Zuvo in oss_vendors",
    "Section 8 does not exclude secondary/tertiary market cores",
    "Coding agents excluded from APO Top-N only \u2014 not from secondary/tertiary markets",
    "Adjacent and Excluded sections present when evidence supports"
  ],
  "interview_complete": true,
  "auto_assumed": true
}
